{
  "schema_version": "1.0.0",
  "baseline": {
    "accepted_commit": "0140fb4f1ab30c7351ce73f14829a8114ae6ec98",
    "policy": {
      "change_control": {
        "requires_human_review": true,
        "requires_issue": true,
        "requires_validation": true
      },
      "new_capability_rule": "Every new kernel capability must map to one existing claim or introduce a new falsifiable claim before it is treated as research-relevant. A feature description alone is not evidence.",
      "review_policy": "Reviewers must check that every claim remains falsifiable, evidence status is bounded by observed evidence, proof references resolve, and changes preserve schema compatibility or explicitly version it."
    },
    "unresolved": {
      "claim:accepted-executor-candidate-build": {
        "falsifier": "A changed carrier, altered accepted executor, missing or mismatched dual-root identity, incomplete required graph, or unauthenticated artifact can establish readiness; or candidate helper changes require a separate manual build despite a supported accepted executor.",
        "proof_refs": [
          "src/decapod/core/readiness_profile/tests.rs",
          "src/decapod/core/snapshot_provider/source_execution/tests.rs",
          "src/decapod/core/validation_runtime/executor_contract.rs"
        ],
        "statement": "For the supported remote source-CI carrier, plain validation admits candidate helper changes using an independently captured accepted executor, retains the full build/test graph and final controller verdict, and rejects substituted authority or custody.",
        "status": "open"
      },
      "claim:atomic-completion": {
        "falsifier": "An unresolved dependency or unproven exclusive task can commit done through a direct mutation",
        "statement": "Every task done mutation enforces dependency and lease proof within its transaction",
        "status": "open"
      },
      "claim:bounded-integration-matrix": {
        "falsifier": "A selected target or test is omitted/duplicated, compilation repeats inside shard runs, or any successful selective-test step takes 300 seconds or more.",
        "statement": "PR integration test execution uses one shared build and complete non-overlapping Gatling shards; every selective-test step finishes in under five minutes.",
        "status": "open"
      },
      "claim:bounded-preflight-latency": {
        "falsifier": "A stale, missing, malformed, denied, cancelled, failed or mismatched input yields readiness; any applicable source obligation is dropped; bounded resource use is exceeded; or comparable measured collection has no material improvement.",
        "statement": "The collector removes repeated exact-request reads and overlaps bounded independent metadata retrieval, while preserving all exact-source and terminal custody checks; CI optimizations reduce measured critical-path overhead without skipping applicable execution.",
        "status": "open"
      },
      "claim:build-layout-compatibility:question:bazel-root-marker-policy": {
        "decision_impact": "Determines whether the root lockfile remains an intentional exception to the canonical build configuration directory.",
        "id": "bazel-root-marker-policy",
        "owner": "Decapod build maintainers",
        "question": "Should a future Bazel release permit the generated module lockfile to move under .config/build, or must it remain root-discovered?",
        "status": "deferred"
      },
      "claim:claim:container-work-preservation": {
        "falsifier": "A failed or interrupted command, local-only history, dirty tracked or untracked work, or unreadable Git status is deleted automatically; or eligible clean successful work cannot be removed.",
        "proof_refs": [
          "tests/unit/plugins/container_tests.rs"
        ],
        "statement": "Automatic container workspace deletion requires successful command completion, branch foldback, verified ownership and a clean Git worktree; failed, unsynced, dirty or unverifiable work remains available with recovery diagnostics.",
        "status": "open"
      },
      "claim:committed-scope-enforcement": {
        "falsifier": "A clean committed forbidden edit, deletion, rename source or over-budget delta reaches provider execution or readiness",
        "proof_refs": [
          "src/decapod/core/validation_runtime/tests.rs"
        ],
        "statement": "Full readiness rejects forbidden-path and file-budget violations across complete accepted-base candidate delta on native and provider routes",
        "status": "open"
      },
      "claim:complete-prepush-readiness": {
        "falsifier": "An empty, stale, skipped-required, mocked-code or missing-provider result authorizes publication, or CLI/RPC/publish bypasses the same boundary",
        "statement": "Public validate can authorize source PR publication only after all applicable actual source checks and candidate builds pass with genuine current material/provider evidence; release-only packaging is explicitly outside core source scope",
        "status": "open"
      },
      "claim:consumer-local-proof": {
        "falsifier": "Real non-Cargo failure passes, stale contract or target passes, or strict profile can downgrade",
        "proof_refs": [
          "tests/consumer_readiness.rs"
        ],
        "statement": "Reviewed consumer local proof executes required commands against exact candidate and target without weakening strict Decapod CI proof",
        "status": "open"
      },
      "claim:container-boundary-integrity": {
        "falsifier": "A failed execution invokes push or PR; raw gh bypasses readiness; divergent host history is overwritten; or successful cleanup deletes hidden tracked edits or new/changed stash, side branch or tag refs.",
        "proof_refs": [
          "tests/unit/plugins/container_tests.rs"
        ],
        "statement": "Container completion never publishes failed or local-only runs, PR requests use the common governed publisher, branch foldback rejects non-fast-forward updates, and cleanup retains index-hidden work plus refs added or changed beyond the returned branch.",
        "status": "open"
      },
      "claim:created-context": {
        "falsifier": "A changed, unrelated, dirty, missing-base or tampered event obtains no-change status or readiness evidence",
        "statement": "Only a provider-declared ordinary first push at the verified accepted target is classified as no change; actual candidate ranges remain strict",
        "status": "open"
      },
      "claim:current-authority-resume": {
        "falsifier": "Changed source, branch lineage, intent, plan, required approval, task revision or lease owner can pass resume; or committing only checkpoint bookkeeping invalidates unchanged continuation.",
        "proof_refs": [
          "src/decapod/core/trajectory/execution.rs"
        ],
        "statement": "Execution continuation checks the checkpoint against current material, accepted intent, plan, scope, policy approvals and task custody; a valid checkpoint hash alone does not grant continuation or publication readiness.",
        "status": "open"
      },
      "claim:current-obligation-evidence": {
        "falsifier": "A required regression accepts stale cached proof, cached dependency completion, malformed requirements, dangling edges or cycles, or an unmet verify/graph command exits zero.",
        "proof_refs": [
          "tests/plugins/health.rs",
          "tests/plugins/obligation.rs",
          "tests/unit/plugins/health_tests.rs"
        ],
        "statement": "Obligation readiness derives from current transitive dependencies and authoritative HealthEngine evidence, not advisory caches; corrupt graphs and unmet CLI verification fail closed.",
        "status": "open"
      },
      "claim:current-task-proof": {
        "falsifier": "A stale or unbound pass completes a work claim, unlocks dependency admission, bypasses aggregate verification, or stale verifier overwrites newer evidence",
        "statement": "Persisted task pass cannot authorize a different task revision, and stale verification cannot overwrite a changed baseline",
        "status": "open"
      },
      "claim:durable-artifact-publication": {
        "falsifier": "Parent sync failure reports success, recovery follows a substituted parent symlink, a partial history is returned as complete, or admitted append crosses its recovery size bound.",
        "proof_refs": [
          "src/decapod/core/atomic.rs",
          "tests/unit/core/events_tests.rs"
        ],
        "statement": "Unix atomic artifact publication requires file and containing-directory synchronization; an error after rename reports unconfirmed durability without claiming rollback, and bounded journal admission cannot append an unreadable head.",
        "status": "open"
      },
      "claim:fresh-provider-metadata-batching": {
        "falsifier": "An invalid or denied batch falls back to another route, a metadata response is reused across invocations, changed source/provider identity passes, or batching exceeds the existing concurrency/deadline bound.",
        "statement": "Independent current provider metadata reads use bounded authorized batches; all identity, cancellation, output-bound and final freshness checks remain mandatory.",
        "status": "open"
      },
      "claim:full-proof-preserved": {
        "falsifier": "Any missing, failed, stale, mismatched or skipped required proof can produce readiness, or an original check command is omitted",
        "statement": "All currently applicable source checks, per-check receipts, exact-source bindings and final freshness remain required under bounded transport and same-checkout grouping",
        "status": "open"
      },
      "claim:governed-context:question:task-class-benefit": {